{
  "$schema": "http://json-schema.org/draft-07/schema#",
  "$id": "project-v1",
  "title": "Chopper Project JSON",
  "description": "Reproducible project-specific selection file. Captures the exact base, features, and ordering used for a trim run.",
  "type": "object",
  "required": ["$schema", "project", "domain", "base"],
  "additionalProperties": false,
  "properties": {
    "$schema": {
      "type": "string",
      "const": "project-v1"
    },
    "project": {
      "type": "string",
      "minLength": 1,
      "description": "Project identifier (e.g., PROJECT_ABC)"
    },
    "domain": {
      "type": "string",
      "minLength": 1,
      "description": "Domain identifier. Operators are expected to invoke Chopper from the domain root, so this field is a consistency and audit identifier that must match the current working directory basename."
    },
    "owner": {
      "type": "string",
      "description": "Domain deployment owner for this project"
    },
    "release_branch": {
      "type": "string",
      "description": "Git branch name for this project trim"
    },
    "base": {
      "type": "string",
      "minLength": 1,
      "pattern": "^(?!\\.\\.)(?!/)(?!.*\\.\\./)(?!.*//)[^\\\\]*$",
      "description": "Path to the base JSON file relative to the current working directory / domain root (forward slashes only, no '..', no '//', no absolute paths)."
    },
    "features": {
      "type": "array",
      "items": {
        "type": "string",
        "minLength": 1,
        "pattern": "^(?!\\.\\.)(?!/)(?!.*\\.\\./)(?!.*//)[^\\\\]*$"
      },
      "description": "List of feature JSON paths in declared application order. Order is authoritative for everything (F1, F2, and F3): layers are applied left-to-right and the last layer that mentions a file/proc/step wins (R1 ordered overlay). If a feature declares `depends_on`, each prerequisite feature must also be selected; P1 topologically sorts this list so prerequisites are applied first, keeping authored order among unrelated features."
    },
    "notes": {
      "type": "array",
      "items": {
        "type": "string"
      },
      "description": "Human-readable notes explaining feature ordering or selection rationale"
    }
  }
}
